ID,Text
1,"I love these cookies. I am on the paleo diet right now and these cookies are what I look forward too. I do like the taste of the tropical one the best. They all have different taste but if you want something that is grain free and gluten free then this is the right place. I expected the taste to be different and it is. Other reviewers seem to expect them to taste like oreos or chips ahoy. Of course not.<br /><br />When I eat them, I don't even feel bad about it because my body welcomes them. They don't make me crash either and feel like I ate junk food. It is a good indicator that these were made from all natural ingredients. I wish I had these cookies close to me. I'd buy them every single day!"
2,"I thought I'd try the multi-pack to see which flavor I liked the best, but I like them all. They are healthy, fulfilling, and all good ingredients I can actually pronounce. These are the smaller packs, and now I can proceed to ordering the larger bags. Love these cookies!"
3,i just started the paleo diet and i love it! lost 4 lbs in like a week! anyway i was so glad to find out there are paleo cookies out there and thank goddess they're good!! i loved the original and when they sent me them i got a sample of tropical and i loved that too! so i ordered the tropical and got a sample of rainforest! at first they're good but if you read the ingredients u'll see there is cayenne pepper in it and im really sensitive to hot spices and i could SOOO feel it on my tong! it was like an after taste. but if u enjoy a little fire with ur sweet u'll like rainforest flavor! really wanna try the alpine flavored ones they're a lot darker in color so it should be interesting :) good job caveman bakery! I LOVE YOU!
4,"I've been Paleo for six months, as has my partner. We both found these inedible. All four kinds (which, by the way, taste nearly the same).<br /><br />I'm not sure what it is about them either. It seems like they would be good from the ingredients. But something about the combination of flavors just does not taste good. I kept trying them again, hoping that they would grow on me. They sure didn't. We finally tossed them.<br /><br />So, I would advise getting just one from a local co-op or something before you buy a whole bunch online. I sure which I had."
5,"I bought a 40 sampler pack from the caveman bakery website. It's not exactly like a cookie consistency however the texture and chewiness of the cookie I like. They kind of remind me of like those natural nut and fruit bars, like kind or something. Of the ones I've tried, Alpine and Tropical are my favorites mainly because alpine has hazelnut and tropical has a coconut taste in it. The least favorite that I've tried is either the rainforest, it has a strong taste of ginger and I'm not a fan of ginger. The other ones are pretty good too. However, I didn't realize that these cookies were so small, but I guess based on the big portions of today's society, this is a normal portion.<br /><br />Overall its good, would I buy again? Maybe if I was on a strict gluten-free diet."
6,Formula itself is great. Works wonders for a baby that spits up but WTF... why is it so expensive here? $121 for 6 12.9oz cans. That's $20 for a 12.9oz can when you can buy a 24oz can at any store for less than $25. Almost double the price...I don't get it.
7,"With all of the choices of things to drink, this is an excellent one. It tastes great. Most of our choices are either loaded with sugar, or carbonated ... even milk is sugar-dense. This drink is good for blood pressure and cholesterol. It is an excellent thirst-quencher. So much better for the hot summer months than sugary lemonade! It does, however acidify the pH. I am supposed to be alkalizing my diet, so I can't drink a lot of this. :(<br /><br />From the time I was a small child, my mother was an advocate of apple cider vinegar and honey for health. Hippocrates would have been happy to discover Bragg Organic Apple Cider Vinegar All Natural Drink: Concord Grape Acai :))) Try it and drink to good health!"
8,"This may not be the best tasting thing I have ever drank but man do I feel instant results after drinking some. I would best describe the effects as very close to the good feeling you experience when you drink coffee. I notice that my circulation feels fantastic like my whole body is warm, a very healthy dose of energy and I dont notice any jitteryness like coffee or energy drinks give you.  The only reason I didnt rate it 5 start is because a 16oz bottle is $3.00 which I think is a little steep. But for the great feeling I get when I drink some I would highly recommend it to anyone else who wants to feel a boost of energy as well as a general sense of well being."
9,"Let me preface this by saying I purchased it at a local health food store for about a dollar less. I was pleasantly surprised with this drink. It tastes great, but definitely a little tangy. What I loved about this was how great I felt after drinking it. I felt awake and focused, and just overall really good. I will definitely be buying more."
10,"I love using generous amounts of vinegar on sandwiches, salads, etc., but this drink was so vinegary that I got a bit of a tummy ache.  It tasted closer to salad dressing than it did a drink.  I tried really hard to like it, but no go."
11,"I bought this drink locally and I have to tell you, they got it 'just right'. If you are like me and you like the flavor of vinegar, this drink will not disappoint, if you also like the flavor of grape. The mixture was done perfectly, No stinging taste, it's sort of mellow, yet has that flavor of vinegar you are looking for. I am highly impressed with it. I went back today and bought 5 more bottle of it at the local Co-op. Braggs is a highly regarded apple cider vinegar, so, to have that kind of base to start with means alot. I can pretty much promise you, that you will 'not' be disappointed if you buy it. They have a couple other flavors, which I will eventually try, but this one has me hooked. hehe )"
12,This is the best ever.  Just add HOT water and mix.  Yummy with anything can even add to cream sauces and soups.  Add some sausage and you are in Heaven.  Yummy Yum.  Cannot go wrong ordering this product.
13,"<a href=""http://www.amazon.com/gp/product/B000KOUM68"">Pioneer Brand Gravy Mix, Country, 2.75-Ounce Packets (Pack of 24)</a><br /><br />I had this gravy  at the Breakfast Buffet in the motel in Branson, MO.<br />Very Good!!! The waitress told me the name, so I looked it up on the Internet and found it at Amazon.  I give it the Excellent Rating"
14,"We use these for our daughter for a few reasons. One, they are healthier than other cereal bars on the market (whole grain). Two, they have yogurt incorporated into the bar. Three, the are thick and do not easily crumble. Since our daughter starting eating them when she was about 1, not having to clean up after she's eaten them is a BIG plus.<br /><br />Plus, they are super yummy for adults too.<br /><br />They are more expensive than others on the market (esp since I can get Nutrigrain bars in bulk at a discount) but they are worth it. Makes our life easier and they don't have a ton of added sugars!"
15,"These are really excellent breakfast bars. Note to the previous reviewer: the Nutrigrain bars, last I checked, had artificial color in them. These don't. They also taste very good. This is our third order through Amazon (great price) and my daughter misses them when we're out."
16,"The flavor of the fruit enclosed is outstanding(bluberry) and if there is  a drawback it is that the blanket that encloses the fruit is a bit thick (unlike this companys fig bars) and pastry textured.Flavored with cane  syrup(not fruit juice).150 cal per bar,and low in fat and the carbs(29) not too bad considering the great taste."
17,I keep a box of these in my desk at work.  They make a wonderful snack or are great if I didn't have time for breakfast.
18,my boys have been eating these for over 3 years now. Recently the box has been redesigned. I like it and it's much easier to open now. It used to have sharp edges and made it easy to get paper cuts. It seems the recipe has changed for the bar. it's softer than what it used to be. The boys still like it. They eat only this all day long if I let them.
19,"I bought these bars for several years at my local co-operative grocery store, and ate them daily--they are tasty. However, the price increased nearly 100% during that time, and I noticed that, although the individual wrappers within the box remained the same size, the bar within the wrapper decreased. When I stopped buying these, the actual bar was only half the size of the wrapper. That's deceptive packaging, so I refuse to buy these any more. I suspect that other shoppers likewise complained, because last month the store where I bought these stopped carrying them."
20,Whole family likes these.  Tasty but not over sweet.  Much more healthy for you than most bars.  Excellentprice through Amazon on the repeating order subscription.
21,"barbara's yogurt bars are okay.  i found the whole grain bar very dry and there really isn't much blueberry, or for that matter, apple flavors.  on the positive side, the bar is a soft chew.  total carbs 29g.  it's an okay bar in the glut of cereal bars to choose from at the grocery store."
22,"My son has been eating these for the last two years and loves them.  I love them because they have yogurt in them, and for a picky eater provides some good nutrition.  Wish they were organic, but we can't have them all.  Much healthier than Nutragrain."
23,"This product was a big disappointment.  The picture on the box is misleading.  These bars aren't chunky, the dough isn't flaky (more like cardboardy), they aren't filled with pieces of fruit, and if you didn't read the label (which claims about 30 items down the ingredient list that ""yogurt powder"" is added), you wouldn't have any idea you were eating yogurt at all.  The bars probably contain MSGs, with all of the ""natural flavorings,"" etc.  Whatever calcium and other vitamins might be present have probably been added in what the ingredients list calls a ""vitamin blend"" -- there's too little food in the bar to give you much nutrition, anyway.  The experience is very much like eating a long, thin fig bar -- only not as tasty.  The fig bars I buy at my neighborhood grocery contain sugar, but also real fruit, whole wheat, no MSGs, and no trans fats. I'd rather eat one of them. I won't be purchasing this product again."
24,"These aren't as good as other bars of this type. My kids won't eat them, nor will my husband. They are all fond of the Nutrigrain variety, but I thought these would be a healthier alternative."
25,Good product! good price  fast shipping . needs an insert in lid to seal container better!
26,"Looked like a good deal, so I ordered the ground fennel, as well as 4 other spices and seasonings from this company, but was disappointed with them all. Zero flavor, not even the fragrance of the right herbs or spices when loosely sealed containers were opened. The dill smelled like dried musty grass, and the onion even worse. Ended up throwing them all away...save your money, DO NOT BUY THIS PRODUCT."
27,I couldn't find this product in the store.  I love the size and the price was just right.  Love the promptness of the delivery.
28,"As an avid rice cracker fan, I've tried a lot of different varieties, and this is the best as far as taste and availability goes. Obviously some of the best are in the Japanese grocery stores, but at least in my case, they're out of the way most of the time.<br /><br />The crackers themselves are savory and crunchy--exactly what I look for in this snack (and this particular mix is nothing but crackers!).<br />Thanks to these, I've stopped trying out the regular grocery store imitations."
29,"Our Corgi loves all sizes, shapes, and flavors of Dingo Bone treats!  The other reviewer commented on the VENDOR; we've never got a bad Dingo yet!  Highly recommended!"
30,When I received this product it was old and dried out!  Dingo makes a good product.  I buy them all the time and my dog loves them but this supplier should pay more attention to what they ship.
31,most of the nuts in these bags were so old they had turned black totally worthless will never order again
32,"I did not even receive the correct product, what I received were raw UNSHELLEd peanuts, but had no option to return them becuase amazon does not allow this. I attempted to contact but got no reply, do not buy from here!"
33,"<a href=""http://www.amazon.com/gp/product/B001EO6BCC"">Royal Oak  Gourmet Virginia Raw In Shell Peanuts, 2.5 Pound Bags (Pack of 3)</a><br /><br />I'll appreciate your speedy deliver of my package, however you sent me raw peanuts without the shell.  This item is going into a gift basket for my Pastor because he love raw peanuts in a shell.  I don't have time to returned them for the requested product. You have always been prompt with my orders in the past and I really do appreciate.  This is the first time you sent me an incorrect product.  I'll make it work."
34,"I would agree with the other poor ratings for Royal Oak - very poor customer service from Royal Oak. We ordered, this year, the exact same product as last year. When it arrived, the nuts were not the same product, and they would not refund or pay shipping for the return. Also, they only operate the few weeks that peanuts are 'in season.' Otherwise, emails and phone calls are not even acknowledged."
35,"I recommand this product. My childrens (5 and 3) love it, pouches as very usefull especially for breaks.<br />To choose. Enjoy"
36,I've tried many different brands of Virginia peanuts but these are far and away the best. I've turned my entire family on to this brand and they've ordered them also. They're superb.
37,"First of all, there are two kinds of paprika - sweet and hot.  Both are delicious but the Szeged sweet paprika is more versatile than the hot kind (which is also awesome!). I have been using this spice for years and the Hungarian type is consistently better than any other type/brand.  Use this on meat, veggies, cassaroles, salad, baked bries, quiches, egg dishes, shrimp, pretty much anything.  I use this in soup all winter long, especially with gulyas levas (this is a traditional Hungarian soup though it is often confused with goulash) and czipetke.<br /><br />This product is the large restaurant size, which is the only size to have if you do any amount of cooking because once you try this you will love it's versatility!!!!"
38,"I was so pleased with this purchase. A great value since I got them on a monthly sale!! I love to have these on hand for they come into play so nicely in so many recipes. Always a joy to have a good ""crunch"" in some recipes. One of my favorite ways to use this larger can is to wrap a piece of bacon around them and secure with a toothpick. Then I dip them in a Apricot Ginger marinade and put in the oven until the bacon is crisp. My family loves an appetizer dinner once in a while and this is one of their favorites. Be mindful that this is a larger can so have a couple of recipes in mind for them when opening, although they do stay fresh in the frig for a while."
39,Not only is the sweetener great in coffee or ice tea it makes a slammin skinny margarita.  Also try their Agava Simple Syrup - LOVE IT
40,"I adore using this very vanilla bean paste ESPECIALLY for my cream pies and ice cream. Why, it's like adding a ""touch of heaven"", but without any of the bother of scraping out vanilla bean pods. The flavor is also better to my liking too than vanilla beans. The price is WAY, way better too and it's stores fabulously on the shelf for ages!<br /><br />For combined shipping, be sure to get their SWEET DOUGH FLAVORING and POWDERED VANILLA too. You'll be glad you did!<br /><br />For more cooking tips & techniques... google my name SharonAnne."
41,"Enfamil Premium Lipil Formula is the same as the previous flagship Mead Johnson formula--Enfamil Lipil--except that it has ""prebiotics"" added in.  Our son was on Enfamil Lipil from September 2007-September 2008.  He was breastfed and formula fed during this time.  Our daughter, who is due in January 2010, will also be breastfed and formula fed for her first year of life.  We tried two other formulas with our son--Similac Advance and Parent's Choice.  The Similac was fine but clumped badly.  During the time we experimented with the Parent's Choice formula, my son was consistently troubled by colds and the flu.  I think the Parent's Choice formula lowered his immunity somehow and will never use it again.  I believe that Mead Johnson's decision to use prebiotics is a good one.  Our son had colic/acid reflux in part because his digestive system was not yet populated with the good bacteria for breaking down milk proteins.  He was a lot more comfortable after we started putting a little Culturelle (a probiotic) in his formula in the evening.  And since a lot of our immune system is in our digestive tract, he had fewer sick days after introducing the Culturelle.  Probiotics and prebiotics will also help infants rebound from the negative effects of antibiotics like amoxicillin quicker.<br /><br />Regarding the bpa found in formula can liners, I talked to an Enfamil customer service representative who told me that Mead Johnson now uses cans that are lined with a ""modified polyester"" that is bpa free.  Similac Advance Earlyshield comes in a bpa-free can also (the SimplePac container).<br /><br />Another concern parents have is the cost of formula.  Name brand formulas are expensive!  But if you think about it, you are feeding a human being for about $15 a week (a can usually lasts us 1.5 to 2 weeks).  $15 a week is peanuts compared to what a hungry teenager devours!  And with name brand formulas you are getting the absolute best product available--Bill Gates couldn't buy a better formula than what's on the shelves at Target or Wal-mart.<br /><br />If you are a new parent and feel overwhelmed by the infant formula section of your grocery store (as I was in September 2007), I suggest starting with the flagship formula of either Mead Johnson (Enfamil Premium Lipil), Abbott Laboratories (Similac Advance Earlyshield), or Nestle (Good Start Gentle Plus or Good Start Protect Plus).  They are all excellent infant formulas.  You just have to see what works for you and your baby."
42,"I wish I found the plastic refill packs instead of 6 giant metaL cans - seems like a lot of wasted packaging.  I just didn't know to look for them until much later.  But, its much cheaper from amazon than the gocery store.  Probably about the same price as costco but no tax here and super convenient. And, the formula mixes well, my kid loves it and (most importantly) his poops seem normal...not nasty formula poops if you know what I mean!"
43,Alot of moms like me like this item because our babies have no constapation on it i love it very much.
44,"no gas for baby, no extra bubbles when you shake it in warm or cold water, mixes perfectly without much time... this is easy.  my kid was happy swapping from breast milk to this with no hesitation when my milk dried up at 6mths."
45,We had to move to formula when our baby was 8 weeks. We have found Enfamil Premium to mix easier than the regular Enfamil Lipil. Our baby has had no digestive issues from the formula. I love getting it in bulk from Amazon as it saves the weekly trip to the store for formula. The price (with free shipping) is comparable with local grocery stores in the Austin Area.
46,Our Baby loves it. And Amazon is very reliable and fast free super saver shipping is always a good deal. Thanks amazon.
47,"I read other reviews before buying and they are not encoraging.. But still for some reasons, I got  to buy (to use my amazon gift card).  But then I am very happy with the purchase. Delivery is prompt. Quantity is correct . Over all a few bucks savings than you buy at a retail shop."
48,"Go to Costco, and you can buy lower than this  price per oz. Currently $32 ($3 off regular $34.99)+ tax for big size = 0.83$/oz.<br /><br />Besides, it is more convinient to return if you kid does not like this formula<br /><br />Be careful, many times some sellers over price a product, and still make the product rank in the best sellers."
49,"Be careful when odering this, because they say it's a 6 pk, but you will only get a 4 pk, plus the formula goes out in 4 months.  So if you did like I did and got it early for grandchildren your out of luck!  So I know I will not be buying off of this site again for food for my grandchildren, because they won't be able to eat it."
50,"If one reads this products ingredients they will find that the first ingredient is cows milk, then SUGAR (diabetic maker), then milk, again. The fourth ingredient is sunflower oil, fifth ingredient is maltodextrin which is starch produced from grain containing the sugars maltose and dextrin, with the seventh ingredient being, get this, tuna fish oil. They even feature vitamin D3, which is animal derived. There are four different sugar sources in it and some artificial flavor for good measure. If we really think about what we are feeding our babies, would we use this product? I know I wouldn't. Know your food sources."
51,Have tried a few different peanut brittle's from Amazon and this is by far the best. It is LOADED with peanuts plus being in a sealed tin makes it seem fresher wit minimal breakage.
52,These were rancid upon receipt.  Terrible.  Very little sugar if any used.  Something went wrong with these as I can't believe anyone would see this as a final product.  Both cans!
53,"I like that these are organic and don't have corn syrup.  My kids and I both like them.  I'd give them 5 stars but I noticed earlier this year that they changed the recipe.  The crackers are lighter and flakier than they used to be and they break more easily.  And if you have kids under 5, you might understand how upsetting broken crackers can be.  The taste is still great, but I preffered the old texture myself and definitely for my kids who cry when the crackers break while they are eating them.  And when you order these in the mail, like I did last time, don't expect many full graham cracker sheets - most are already broken in two, and quite a few are broken at the edges as well."
54,I have been buying  new Morning Graham Crackers since February of 2010. Never had a Problem with damage of the crackers in shipping .<br />Why Did Amazon Remove the Graham Crackers From Subscribe and Save?????  Why Did Amazon Remove The Graham Crackers From Prime ???The Crackers are a much Higher Price From a Third Party Seller. I will Purchase the Crackers From Whole Foods . Not Fair of Amazon to Take Away the Connivence of Ordering a Case
55,"My husband has to limit the amount of sugar he takes in and these contain no sugar, and they taste great!"
56,"I rarely want to eat much when I first arise in the morning; but I do have coffee.  I've found that these cinnamon graham crackers work great for me as a little something to eat along with my coffee.  They are graham crackers - not anything super-duper amazing - but they are nice, cinnamony graham crackers that are organic."
57,"My children will only eat healthy products, and they love these graham crackers.  I am so glad that they are available through Amazon!"
58,"These crackers are terrific, and they are priced right.  However, i ordered them on 10/29/06, and the expiration date on the box was 12/31/06.  We have only eaten four boxes.  They still taste fine after the expiration date, but... am i really expected to consume 12 boxes in 2 months?"
59,"These are very good, they were a great price and fast-free shipping when you purchase enough food.  The only thing is that the box was smaller than I guessed it would be."
60,"I was quite surprised to find that Sociables were available thru Amazon. I cannot find them in the local supermarkets and thought I would have to give them up.<br />They arrived quickly, in great condition, and we now are on regular shipments of them."
61,"I felt ripped off. The photo clearly shows two bones and the price, at $8 plus, is indicative of two. I thought I was purchasing a ""bone"" packaged as two to a pack. Walmart sells identical big smoked knuckle bones for $3.50 ea. Why doesn't the photo show one bone instead of two if they are just shipping one? It wasn't worth the hassle to return the package to make my point of protest so I am doing it here.  Beartoothjoe"
62,"Wow I heard of this candy but could never find it, now I am hooked. Now I don't have to suck on child lemons with salt, just shakey shakey."
63,"I absolutely love these! Seven of these sweet, very thin Graham Crisps are only 60 calories, but it's easy to eat a lot of them and there are almost 80 in the package. Delicious by themselves; wonderful with ice cream. If they are purchased using Amazon's Add-on Program there is no shipping charge.<br /><br />UPDATE:  I've seen mixed reviews of this company's products. The items I've purchased have not been stale or strange smelling."
64,"I love the 34 degree cracked peppercorn, wheat, and other varieties so I thought I would try the caramel, cinnamon, and graham as an alternative to cookies or regular graham crackers. True - you can have a lot of these crackers for little calories/carbs, but the flavor is bland. In terms of satisfaction, they don't quite cut it for me as a snack unless I put peanut butter or something on them. They would probably be good as part of a fruit and cheese dessert platter, along with some peanut butter, fruit spread, honey, or cream cheese."
