ID,Text
1008,"So let's be honest. I have severe anxiety and depression issues which has gone on my whole life. I have been prescribed dozens of different meds to help with it but nothing has. Also, I don't have insurance so I literally put out hundreds a month to try new drugs that didn't help. More importantly, the side effects were sometimes as bad or worse than my symptoms. I have also tried other natural cures that didn't help.<br /><br />Several of my friends suggested I smoke hemp as a natural cure. I'm not against it but I'm not a smoker and I've had professional jobs where I could be tested, anyway. So I thought, let's check Amazon and see what natural hemp products are available.<br /><br />First I tried hemp powder, which I also reviewed if you're interested, and it tasted like sand. It will take me all year to be able to finish the 3 lb bag and that's if I ever do. Then I tried this.<br /><br />I'm very honest in my reviews so I wouldn't recommend this if it didn't truly help. It's not a placebo-effect thing, either. I have tried too many meds for that to even be a possibility, trust me.<br /><br />The one thing I can tell you for certain is within the first week it greatly and noticeably increased my energy levels. I have done more around the house in the past few months than I've done in the past few years. I have gone through 2 subscriptions of this and the energy hasn't gone away. I am a big and tall person so I take 4 in the morning and 4 at night, usually.<br /><br />Anyone who has depression/anxiety issues knows that sometimes you barely feel like getting out of bed most days. You get a heavy feeling like there's lead in your veins. If you've been through it then you understand what I'm talking about.<br /><br />I can say with 100% honesty that it has given me way more energy and it has helped with that heavy feeling. Can I guarantee it will work? No. My aunt and mom tried a couple just one time and they didn't notice any difference. But it has sure worked for me taking it daily. What I can tell you is that you should at least try it. If it doesn't help, just don't buy it again. But it is sure worth a try because it might help you as much as it has me. I will take this supplement for the rest of my life, as far as I'm concerned. That's how much it has helped.<br /><br />I hope it works for you, too."
1009,"This HEMP OIL is excellent stuff. For real, if you are using fish oil, this actually has MORE omega 3's and has many other medicinal values.<br />Combine this with hemp seeds (in smoothies) and you will notice a difference in any aches in your knees and your hair will shine and your body will be filled with antioxidants.<br />ANYTHING HEMP ROCKS. YOU WILL NOT BE DISAPPOINTED in this product and it came on time and was packaged well. (3) bottles for this price is a great value."
1010,"The capsules are easy for my wife to take, they really help her crohn's disease. After reviewing and reasearching we found that hemp seed oil helps crohn's disease. She has tried all the prescription meds which if you read the after affects on them they are worse than the crohn's disease. This product has really helped her from having to many episodes or being sick as often."
1011,"I'm not one to believe in supplements, but this product was the only thing that helped my anxiety. I was getting really bad panic attacks from what my doctor said was anxiety. I feel overall much healthier after taking this product and I haven't had barely any anxiety issues. Definitely recommend this to anyone that is trying to tame their high stress or anxiety."
1012,"Our acupuncturist recommended this to us,  to lower my cholesterol and to lower my husband's blood pressure.  So far so good.  We have been taking it for a little over a month, so in a few more months, we'll have a better idea of its effectiveness.  We take two capsules in the morning and two at night"
1013,"This is a great source of essential fatty acids without the unpleasant tasting burps of fish oil or flax seed oil, which also doesn't agree with my stomach.  I also think it helps my IBS symptoms."
1014,"I take it every day. I used to take fish oil but when I made the change to plant based oil for my body, it was like night and day. I felt the change, and loved it."
1015,"This product is excellent! I HIGHLY recommend it... It has the balances of nutrients I was looking for but also non GMO... The product shipped quickly and is very high quality hemp seed oil. I'm extremely impressed! I can't wait to buy my next supply because of all the benefits! I've already noticed a difference in how my skin behaves, how my hair grows and the strength of my nails and I've only been taking it for about 10 days!! I don't experience nearly as much nausea with taking this supplement as I do with others (such as flaxseed oil) and I also don't have to worry about the presence of GMO substances in it either. Thanks again for selling such a wholesome product :)"
1016,"This has been a boon for my digestive system! I take 3 tablets twice daily -- morning (after breakfast) and evening (after dinner). I haven't had any problems whatsoever for at least the last couple of months of taking the Hemp Oil capsules! I plan to continue taking them for a long time into the future!<br /><br />BTW, I started taking these capsules because Hemp Oil contains essential Omega-6 and Omega-3 fatty acids in the 3:1 ""balanced"" ratio, and the capsules don't have the ""weird"" after-taste that plain Hemp Oil does."
1017,I purchased the hemp oil for my mom to help with pain relieve. The Omega oils are suppose to help with join movement and pain. I have noticed that when she takes the vitamin her pain is less than the times that we are out and she has to wait.
1018,I Love this brand....and please tell EVERYONE you know...Hemp oil is sooooo beneficial for you...do your research...you will understand that getting 3 Omegas and some
1019,It is hard to tell most of the time if supplements work but I just have a greater sense of well being when I take this product. It really is a good source for essential fatty acids. I expect to keep taking it.
1020,"The hemp oil soft gels really help my sensitive digestion (along with the probiotic, enzyme and lactose pills).  Of course, I still have to watch what I eat and how fast I eat it (slowing down really helps bad digestion).  I suggest buying this product in bulk because the more you take the better it seems to help."
1021,"I've tried most of the Virginia chutney Co. (VCC) product range and particularly like their spicy plum chutney. It is good with cold meats, salads, cheddar cheese, and curries"
1022,"I first tasted this at Petrossian.  I had ordered Green Tea and when I tasted it, I was a little shocked that it was not regular green tea.  I noticed the citron immediately and it was fantastic.  It complimented the tea very well.  The tea is very light.  Au Bon Pain also carries this tea.  Try it out!"
1023,"One of my favorite restaurants serves this tea iced. They were kind enough to share the brand name with me when I asked. It makes wonderful, refreshing and healthful iced tea. Highly recommend."
1024,"As a gum addict, I was looking for a natural alternative to the artificial-flavor/artificial-sweetener varieties. This gum is great. Now, the flavor comes from real peppermint, so it's not going to last as long as the fake stuff, nor it will be as mind-blowingly intense as some of the new super-flavored gums.  But if that's ok with you and you'd like to chew something that doesn't put weird chemicals into your body, this is for you.  It's expensive, sadly, but what can you expect? Buying it in bulk here helps."
1025,"I like to chew gum and I also like my teeth.  I am also allergic to most artifical sweetners and it is getting more and more difficult to find sugar free gums that do not contain aspartame.  This is why I purchased this product in the first place.  I like the flavor and it lasts quite a long time.  The packets are the perfect size to fit in your pocket or purse.  I always have some on hand at work, especially for after lunch.  I will certainly be buying more."
1026,Very tasty gum and the xylitol is wonderful.  My youngest daughter's dentist recommneds that she chew xylitol gum 3 to 4 times each day to help prevent cavities.  Her baby teeth had a cavity in every tooth along with three crowns!!!!  Her adult teeth seem to be much more cavity resistent and I believe the gum is helping prevent the cavities.
1027,"If you look at the vast majority of sugar free gums in the store, you'll see all kinds of nasty chemicals on the ingredients label.  There are a few xylitol sweetened options available online and at health food or vitamin stores.  Xylitol is a sugar alcohol that can safely be consumed by diabetics and purportedly PREVENTS tooth decay and has some other health benefits (research it).  XyliChew is the only brand I've found that I can definitively say is NOT produced in China or sourced from materials produced in China.  XyliChew is produced in Finland.  Given China's contaminated products record the past few years, I would trust a product from Finland over China any day.  The gum itself has a nice peppermint flavor that does not last too long.  That's okay by me, as I generally just chew this gum after a meal for dental health.  It's pretty expensive, but you can get free shipping and a discount through Amazon's ""Subscribe & Save"" program.  XyliChew comes in other flavors, but the last time I checked Peppermint is the only one available through the ""Subscribe & Save"" program.<br />**IMPORTANT NOTE: Keep any products with xylitol away from dogs; it's toxic to them."
1028,Have had this gum from other sources and always liked it. This particular shipment seems to have much less peppermint flavor than before...could be it is older gum(there is no expiration date on it) or they are making it with less peppermint now. Otherwise I received this order very quickly.
1029,"This is an excellent sugar-free gum for those who don't want saccarine or aspertame. Many commercial gums that are advertised as containing xylitol also contain unnatural, chemical sweeteners. The flavor and soft texture lasts very well in the peppermint and fruit flavors. Another family member really enjoys the licorice one. The chocolate has a disappointing flavor, and the cinnamon, which to me tastes like almond at first, quickly gets hard and loses flavor. Haven't tried spearmint. While the serving size is listed as 2 pieces, I find 1 is exactly the right amount for my mouth."
1030,"I'm into maximizing health. I don't use any artificial sweeteners or refined sugars in any form. Xylichew was a great find because its ingredient list is actually safe. This is rare for a gum. The gum has a great taste, it has the right amount of sweetness, and the pieces are a good size. I take half a piece at a time, while my wife prefers a whole piece. If you are looking for a safe gum - this is the one. And Amazon has such a sweet deal on it - don't pass it up!"
1031,The advertised regular price of $99.99 is ridiculous.  5 hour energy drinks are widely available for $2.00 each.  Don't buy from sellers who inflate prices and charge ridiculous amounts.  You can get a case of 12 for $20 right here on Amazon.
1032,"I had a very long day. Got to work early, worked about nine hours, headed for the airport and had to go through a connecting flight and about 5 hours of travel. And when I got home I still had some work to do and needed a boost to get me through it.<br /><br />After hearing a radio ad for this product, I picked up a two-pack and used one of them when I got home.<br /><br />It promised five hours of energy without crashing. I can't attest to the five hours (didn't quite pay attention), but it did last for quite a while and I had no crash effect in the end. I wasn't overly anxious or nervous, but I could think clearly and get the work done that I needed to get done. So it most definately delivers on its promises.<br /><br />The things that I like the most is the fact that there is no sugar. I also appreciate the fact that they use water instead of carbonated water, which is the main reason I don't like the Monsters, Rockstar, Red Bull, etc products (diet versions, of course). It also gives all this energy in 2 ounces instead of having to drink a large soda can worth of drink. The taste wasn't fantastic, but it could have been much worst and only takes a good gulp to get it all down.<br /><br />I've been looking for a product like this to get me going in the mornings and this seems to fit the bill. My only problem with this is that it is a bit on the pricey side. Today I am also trying out one that is similar, called Enduroshot, a 2.2 ounce energy shot that claims all the same benefits that this promises but at a MUCH lower price. I'll do a review on that sometime soon in the future. If I feel just as awake and alert as I do with 5-hour energy, then I will use it instead. Otherwise, Chaser has a new, steady customer."
1033,"although the taste leaves something to be desired, 5-hour energy worked very well.  i drank one halfway through my workday, and pepped up enough to go out and wash the ambulance.  my arms hurt later that night, but the product itself worked for me."
1034,"This is a great price, but every time I've bought these through Amazon, the bottles frequently have dark... ""stuff"" on the threads of the bottle when you open it.  I've never seen this when buying them from the local drugstore, so I worry that these are either old or maybe not authentic?<br /><br />Can't say for sure of course.  They do have the desired effect, so I'm not complaining too much.  It's kind of gross sometimes though."
1035,well u get the energy u really want for the 5 hours and it really boast u a bit but that u will be calm again and need to rest.. not bad great product
1036,"The energy drink is a great product. The shipping price is crazy tho. I paid more for the shipping then both products together, so not a great deal."
1037,"I recently gave up my major 20 year Diet Coke addiction.  I did it for a number of reasons.  I typically wake VERY early to hit the gym before work & needed something to help me wake up at 4:30 AM.  This product is GREAT.  No over-stimulation as it only has the caffeine equivalent of 1 cup of jo. It is also SUGAR FREE and has 0 Net Carbs!! I do feel the energy quickly & it lasts the 5 hours it claims.  The berry flavor is pleasant, but tart so I drink some water as a ""chaser"" (no pun intended).  I drink water the rest of the day & only use 1 in the morning unless I have a ""late"" meeting scheduled."
1038,"Finally, a product that gives you that extra boost you need for anything from travel delays to the overdue stack of paperwork. You feel the effects instantly with more energy and a higher concentration level.  It stays with you and does not leave you feeling dopey or spent when it wears off."
1039,This is the best energy product I have ever used. It starts working right away and keeps you going for a long time.
1040,"I took it at 5am yesterday. It is now almost 3am the next day and I am laying in bed and skin feels tingly, can't sleep at all. I feel like I am at super sayan level 4, power of the red monkey. I could shoot ki blast out the window if I wanted too. Maybe some kame hame wave's too."
1041,"I sampled this cake as offered from Biscoff 1 month ago and fell in love.  It is extremely moist and is most delicious when sliced thin to accompany a cup of coffee. The ingredients are perfectly blended as no one taste is overpowering, but you are able to taste each individual ingredient.  If you are looking for a great coffee or tea accompaniment, please give this cake a try!"
1042,"This is the moistest, most delicious cake in the world.  if you like almond tarts, marzipan, that kind of taste, you will be in love with this cake.  Normally I think packaged cake is awful, by the way.  This one is amazing."
1043,"First, the ingredients list is wrong.  They are almonds, not cashews.  I don't have a recent bag (just ordered), but I have seen some with tapioca syrup and some with rice syrup listed in the ingredients.  My 6 year old son has tons of foods he needs to avoid, so these distinctions are important to us!  Luckily, he has been able to eat these and loves them.<br /><br />The pieces in the bag vary in size.  The most typical is about 1-1.5"" long by ~3/4"" wide.  There will be some loose crumbs in the bottom too.  It looks like they make them in a big pan and then cut them down.  I would compare them to bite-size (or 2-bite sized) granola bars.  It is just the right amount of sweetness added.  I love that these have a nice protein boost when I need to grab something and go."
1044,"I spent some time searching for an alcohol free rum flavor to make daiquiri sorbet, and LorAnn has produced the best flavor thus far (which tastes outstanding).  It blows away the competitors that I have tried.  Baking with it has not yet been attempted, but I imagine there would be similar results.  The price is quite reasonable for a 4 oz bottle, although it is much more so if multiple bottles are ordered (save on shipping).  It has natural and artificial ingredients; I would prefer it to be all natural, but that's a price I'm willing to pay for the flavor.  I predict this will remain my alcohol free rum flavor of choice."
1045,I bought this bag and found it 50% cheaper at smart and final. It was also old and and white. This was terrible! I bought it to put in the candy canisters I give to co-workers. So I didn't find out it was OLD till a co-worker informed me. I was so embarrassed. Do not buy this candy. It all ended up in the trash. Very disappointed!
1046,"This candy was obviously old. Each chocolate was discolored. The Krackel krispies were not crispy and the chocolate wasn't right. Peant butter cups and Goodbars nasty, the nuts are horrible. Hersheys pulls their candy off of the shelves in the stores when it is getting old. Seller must have bought it up & sold it here last year or the year before. It has to be at least 1 or more years old. Do not buy chocolate from ZANY Values, it isn't good for you!!<br /><br />I'm sure that if the candy were FRESH that it would have been just fine. I have re-ordered from a different vendor and will let you know if theirs is fresh (as it should be) or not."
1047,Raw is eating from your Organic garden of fresh grown fruits and vegetables.It is also all the nuts growing from the mountains that surrounds us through out the land from the forest. Although grown from a tiny little seed that the sun and rain helps in growth it is our heavenly father our creator God who truly makes them grow and should be appreciated for his gift of life to us all and for our home the planet we call earth .<br />I used to be a true vegetarian then I went to only eating Poultry and some fish and eggs through out the years.Now I will eat vegetarian soup made with some beef stock but I don't care for the meat itself and no pork.<br />I am still Organic Alternative and Green but I am slowly trying to go back to being that true vegetarian that I used to be however going raw will take a some time because I have a little hard time chewing with my teeth like my friend but after I get my dentures I will be able to adjust into it .Right now I am canning for winter storage.I have dehydrated my whole garden into green super power food that I added to my barley greens. note if you choose to cook get the Fagor Pressure cooker caner That I got it helps make the meals go quicker and is a lot healthier than baking and Broiling or grilling and never fry food.<br />Well I will let you know how the canning turn out and one day I'd like to make home made all fruit yes that's right not jelly or jam.<br />Hi Again so far so good I have canned 4 pint jars of my home made spaghetti sauce with 4 of Chili and 4 vegetarian soups with 2 red cabbages and they sealed and are ready for winter when things get rough as around here it is hard to get organics so when I do I get all that I can like I just got up at the farmers market this late fall and then I either freeze them or can them and even dehydrate them.<br />So I will keep you up to date but I need to try and get some organic fruits and that is hard to get again around here.<br />well catch ya later as I never say goodbye!Just get this wonderful organic fruit nut and seed mix it has no preservatives and is delicious and affordable and if I can get it you can too. Just remember to soak the nuts and seeds because nature puts some  protective coating on it and they need to break down this to be edible and fit for human consumption.
1048,Put two tablespoons. in a large cup of fresh coffee and you have a great coffee mocha.  I have recently tried several others that have been recommended and got great customer reviews online.  None are as good as this one.
1049,"If you've never tried any of Ghirardelli's hot cocoa products you are in for a treat! Made with milk, the cocoa is far superior to any other cocoa product on the market. I don't drink coffee, but have a cup of this every morning. When made in the Froth Au Lait hot chocolate/latte maker, you will get the best cup of hot cocoa you ever had."
1050,This is the best hot chocolate next to Cadbury bought in Europe.  Our 13 yr old would never drink her chocolate milk until we switched to this (unfortunately we don't have a steady supply of Cadbury's).  It's great!
1051,"I usually buy this from Starbucks, but after buying this item on sale I will be making my coffee at home. I am not a heavy coffee drinker but sometimes when I have to study I need a quick pick me up and this will do it. I love all their product. Sometimes I add a little cinnamon grade AA and it really gives it a boost. I would definitely buy this product again and I think it is a good price. I saw it for a lot more in the store."
1052,We appreciate the short list of ingredients on the Ghiradelli hot chocolate mixes.  The Chocolate Mocha flavor is rich and chocolatey with out being overpowered by the coffee.  This is one of our favorite cold weather drinks.
1053,Found this product discounted at a good price at slickdeals.net for about $10.<br /><br />First time drinking this stuff since I bought it.  I was blown away at how awesome it taste.  This was my first time trying something other than the Nestle brand cocoa (other than the few times I ordered cocoa at a cafe).<br /><br />Has a nice blend of mocoa/cocoa and doesn't taste too sweet like what I'm used to with Nestle.<br /><br />Definitely giving this a thumbs up.
1054,"Heat 8-10 oz 2% or whole milk, not quite to boiling, in your microwave. Add ~1-1/4 rounded teaspoons of Ghirardelli Mocha Hot Choc powder + ~1-1/8 rounded teaspoons of Ghirardelli Hazelnut Hot choc powder, stirring to fully mix. Now add ~3/4 oz Christian Brothers VS Brandy. (Optionally) garnish with whipped cream or a small accent of vanilla ice cream and serve.<br />Notes: Not to be a brand whore, but Christian Bros (VS, not the more expensive VSOP) is the only brandy I've found to really have the right profile for this recipe. Exact proportions for all 4 ingredients should ultimately be to your own taste. Non-fat and 1% milk are NOT recommended. The brandy should contribute its flavor but not be so strong as to have an obvious alcoholic note. I've for many years used a 1.0 Mocha + 1.5 Hazelnut ratio, but lately the Mocha product hasn't seemed as intense, so I've adjusted. You'll know it's right when the mocha + hazelnut + brandy flavors are in such balance that none is too dominant -- the result will be a new experience ""greater than the sum of its parts."""
1055,I did not expect this hot chocolate to be quite as sweet as I found it to be. It also has more calories than previous Ghiradelli similar hot chocolate.<br />It has a rich taste and if I were not concerned with weight I would overlook the higher calories.
1056,"While you would expect Ghiradelli to make good chocolate, the flavor of this mocha cocoa is precisely that of great darker chocolate flavor, using just enough coffee flavor to accent the cocoa without overtaking it.  A smooth, delicious start or finish to your day - even a warm afternoon pick me up on those chilly days!"
1057,Premium Ghiradelli chocolate mixed with just a hit of coffee makes this a great drink.  I've gotten to where I add a heaping spoonful to my Starbucks coffee every morning.  It gives it an extra coffee flavor and the chocolate for Ghiradelli far exceeds the 'mocha' chocolate you get at most barista stands.
1058,I use this product with my home brewed espresso and milk to make a mocha latte.  It's terrific!  I ordered on the auto ship plan through Amazon and save about a $1.50 per can over buying it locally.  Plus I get the added benefit of having it delivered to my door instead of having to drive to a specialty shop to get it!  Great product and great service.
1059,"I love this hot chocolate. In my opinion, it's the best on the market.  It has a nice grown-up flavor of chocolate and coffee."
1060,I don't know what all the positive reviewers here are raving about. I tried Ghiraradelli's premium cocoa mix and found it much too sweet that it was almost unpalatable. And not a very chocolatey taste either. The directions given for one serving are 4 Tbsp of the powder to 8 oz of milk.  Did they meant 4 tsp?  Using their directions would yield a total of 8 cups of hot cocoa -- not very economical for a product with so much sugar.  I had high hopes for this product but was very disappointed.
