ID,Text
728,"I am a professional chef and specialize mostly in pastry, cakes, and desserts. It plays hell with my diabetes but I just love creating some delicious dessert for friends when we have small gatherings.<br /><br />I usually buy vanilla beans in Tijuana, Mexico because I can get good quality at a decent price. By that I mean the beans tend to be supple, shiny, and aromatic. By ""decent price"" I mean it usually costs me around $1.50 to $2.00 per piece.<br /><br />When I saw this half-pound package at such a low price I was skeptical but I figured the $25 would not be a big risk and if they were bad I can always return them. I ordered on Jan 11 and got them Jan 13. Free two-day shipping being another great feature of my Amazon Prime membership which I now believe is an excellent value.<br /><br />The beans are very high quality. They are ""Gourmet Bourbon"" which means about 30% moisture (a good thing) and they are shiny and nicely oily (you want the oily surface as that is one part where a lot of flavor is located. The other part is in the seeds and that is the reason the bean is split and the seeds scrapped when used).  These beans are very fresh as shown by their flexibility (as beans grow old they dry out and get brittle- still usable but not as good).  They come sealed in a vacuum bag and that is inside a zip bag. Even through the double packaging the scent is very noticeable and complex.<br /><br />This is a large quantity of beans. If you are not going to use them rapidly I recommend separating into two or three bean lots and vacuum packing those. For optimal shelf-life I keep mine in a wine refrigerator (it gets cool but not cold) where I keep my 20 or 30 pounds of various chocolates.<br /><br />This is an excellent deal on good quality. I just can't figure out how they manage to make a buck on this one!"
729,"There are a ton of vanilla beans in this package. They are supple and so fragrant, you can smell them without breaking the seal. Truly a fantastic deal."
730,"Just received my beans today and wow!  There's an amazing amount for the price paid, they smell absolutely fantastic and came vacuum packed so they'll keep practically forever."
731,This product smells so bad that I couldn't even try to consume it.  It smells sour and rancid and is detectable even before the package was opened.  The seller has a no return policy so I'm out the $ I spent on this as it will go right into the garbage.
732,"I purchased these with the intent to make vanilla extract. The bean arrived in a timely manner, and were in a vacuum sealed plastic bag. They didn't smell super 'vanilla-y' when they arrived, but I can attest that they were soft and pliable-- maybe too pliable and greasy though. Almost immediate of being immersed in it's vodka home, the beans left an oily residue on the top of the glass bottles. The grease has not necessarily gotten worse, but it has some type of oily smell that distracts from the richness of the vanilla. Any one else have this problem?"
733,"I have been making wonderful homemade vanilla with a recipe that I found on line using vanilla beans purchased from Williams Sonoma. I decided to try Spicy World Vanilla Beans rather than the much more expensive vanilla beans from Williams Sonoma.  Two vanilla beans from Williams Sonoma in a pint of vodka resulted in a very dark richly aromatic vanilla after only two months.  I used three Spicy World vanilla beans in a pint of vodka and after two months I had a liquid that looked like weak tea and had the aroma of alcohol.  I added three more beans and waited.  The results were disappointing, so I added three more vanilla beans.  You can still see through the vanilla and it doesn't have the aroma of vanilla.  I am completely disappointed with the vanilla beans from Spicy World.  They are totally worthless, a complete waste of money.  I would not recommend them or purchase anything from Spicy World."
734,"Vanilla beans have many uses: you can make vanilla sugar, creme brulee, and many other desserts. You can also make vanilla extract. And if you buy these beans, you can do it all at a fraction of the supermarket price.<br /><br />Yesterday I priced two vanilla beans in a spice bottle at the supermarket. They cost almost $6. This half pound package of beans that comes in a vacuum pack contains at least 50 beans and cost only $25. I am not quite sure what I will do with all of these, but we did make some bottles of vanilla extract for our favorite cooks for Xmas, and I have vanilla sugar in my cupboard now. The fragrance of these beans is marvelous, but I have resealed the package so the beans won't dry out. I may even put a few beans on the counter to make it smell like I have been cooking!<br /><br />A recipe:<br /><br />1 cheap fifth of vodka<br />10-12 beans, sliced the long way.<br /><br />Remove a cook's share from the vodka bottle and replace with the beans. close the bottle. Let sit for at least a month in a cool dark cupboard.<br /><br />Decant some of the vanilla into a smaller bottle when you need a refill. Put another sliced bean in there, and top off the large bottle with more vodka. Use the smaller bottle for your cooking. Make lots of cookies!<br /><br />You can keep this up for about a year."
735,"I ordered and got this the next day. Planning to make vanilla for Christmas presents [...]). There were 70 beans in my package - THATSALOTTABEANS - I split it with a friend because I don't think I know 70 people who love to bake. . . On their own, they smell somewhat like raisins, but in the package, the smell is heavenly. Crossing fingers that the vanilla works out! but at what, 40 cents a bean, I haven't lost much and the price is so much better than the grocery store, where I looked at 2 beans for $12."
736,"I wanted to give homemade vanilla extract as gifts and was extremely satisfied with these beans. They made very high quality extract and were much cheaper than at local grocery or organic food stores. I was mildly concerned by the size; I only needed 24 beans, and ended up with closer to 50. However, my brother has used the remainder to make delicious vanilla ice cream, creme brulee, tiramisu, custard, vanilla sugar, french toast, etc. I have recommended them to friends and family."
737,"I don't understand(believe) the ONE negative review posted here. Why are they the only dissatisfied customer?<br /><br />My 1/2lb Madagascar Bourbon Vanilla Beans came in 2 days, and the whole box had the wonderful aroma of vanilla even before opening it!<br />My dark, 8"" long, moist pliable beans were vacuum packed and tucked neatly in a sturdy zip bag.<br /><br />Oh the plans I have for these gems!!<br /><br />I'll be sure to post an update after utilizing my beans!"
738,"I'm constantly trying to find vanilla beans at a reasonable price. Often, when I do, they are hard as rocks, dry, and practically unusable.  I was so frustrated at Safeway where one bean was $13(!), dry and hard as a rock. The best I've found was at Trader Joe's, where I could get three beans for $10. They were decent...<br /><br />This price was SO reasonable, that I worried they were not going to be fresh/good/etc. I was wrong. The beans were incredibly fresh and supple. I'm using them to make vanilla extract and they have worked perfectly. They keep well in the fridge, so I'm using them in everything!<br /><br />The price is great, but there might be too many to use--if that's the case, then split them with a friend. Then it becomes one of the best culinary deals ever.<br /><br />Absolutely wonderful. I will buy these again and again."
739,"I've never bought vanilla beans before, but I have seen them in the store - all dry and crusty looking.  These beans are vacuum sealed, and because of that are still moist.  They smelled great.  My whole pantry smelled wonderful after I put them in there, and they made my homemade vanilla bean ice cream the most vanilla-y ice cream I've ever had.  (Even more vanilla-y than Blue Bell!)  When I run out, I'll absolutely buy more of these!"
740,"I just got these, they are moist and gooey and fresh.  I actually got more beans than the approximate ammount.  They came faster than expected.  Great transaction!"
741,"We were running out of vanilla. I'd made my own before using vanilla beans and vodka, and the price of these was far cheaper than getting them locally. I figured it was worth a shot.<br /><br />I'm not sure what I was thinking, but half a pound of vanilla beans works out to something like 50 of them. It's hard to picture 50 vanilla beans, but this would be a good order to go in halves on with someone. Or quarters.<br /><br />The aroma is incredible. It's been a couple of months since we originally opened them, and our pantry still smells like vanilla, even though they are wrapped in two ziploc bags.<br /><br />As for the vanilla itself, it is fantastic. If you've never tried vanilla produced yourself, you are absolutely missing out. There is a distinct and definite difference between homemade and what you buy at the store.<br /><br />Do yourself a favor, hit ""add to cart"" and check out. You'll be glad you did."
742,"I purchased these vanilla beans to make homemade vanilla.  This is my first vanilla bean purchase ever.  I was very pleased with the quality of these beans.  There were approximately 50 beans, and they were large, very fragrant, and contained lots of ""caviar"".  I could see the extraction starting to take place shortly after I split and immersed these in my vodka.  I should have some wonderful vanilla extract in 6 months.  Thanks!"
743,"What an incredible price for this many high-quality vanilla beans!!<br /><br />I split them with a friend of mine and we've both been making our own extract with delicious success.  At first I thought I might not be able to find use for all the beans, but because I LOVE to make my own (vegan) ice cream, I'm now totally spoiled by these beans.  I grate them into my (non-dairy) milk and simmer it, then let it cool in the fridge overnight, then go about making my ice cream.  I never want plain vanilla ice cream without using fresh beans again, no way!  It's too good.<br /><br />What's more, have you ever bought beans from the grocery store?  It costs, like, $12 for two or three beans, and the beans are relative garbage.  These aren't dry and odorless like the ones from the store.  Instead, they're moist, soft, and have that delightful aroma that makes you just want to bake."
744,"It is a lot of beans to go through but the flavor and quality is really nice. They are fresh, soft and very fragrant. I use a lot of vanilla bean because my family loves vanilla sauce and baked goods made with the fresh bean. You must seal these very tightly to keep them soft but with care, they will stay nice for months and you can't beat the price! One company sells vanilla beans in a jar and you get two or three beans for anywhere up to $6! And the quality isn't anywhere near what these are. I will continue to buy this product. I've ordered these before and I am still thrilled with the product."
745,"These vanilla beans are so fragrant that you can smell them through the unopened package!  I used them to make my own vanilla extract as Christmas gifts, and they worked great!  Don't be fooled by the product photo: they look stiff and dry in the image, but they're soft, pliable, and moist with vanilla oil."
746,I was very happy with the quick delivery of this product and how fresh the beans were.  I am looking forward to my homemade vanilla extract once it is done brewing.  I would definitely buy from this seller again.
747,"I purchased these beans based on other reviews.  My plan was to make a Premium Vanilla Extract for family members.  I purchased a very expensive Vodka, unusual bottles to fill, and waited for my bean order to arrive.  I wasn't happy about the wait.  The beans arrived after the 4th, and I rushed to open the package.  I could not smell the beans as others reported!  Most of the beans were skinny/shriveled, more dry, and a great disappointment.  I Would Not recommend this product.  I will be looking for another source."
748,"I received my vanilla beans exactly a month ago today. As soon as I opened the package I LOVED them. They were very moist and I was very pleased at the quality of the beans. I immediately used 18 of the 50+ to make homemade vanilla extract. The beans did not come with storage instructions so I googled it and read that I needed to store them in an airtight container. I've used them a few times over the past month for cooking but I still had over half the package left. Well, when I opened them this evening they were MOLDED. I am so very disappointed that I will be unable to use the rest of my beans. :( If you're able to use all 50 as soon as you get them, then I highly recommend these beans. If not, then I would look elsewhere, or order a smaller quantity."
749,Having been a professional cook for over 20 years I try to seek the best ingredients.  I was very pleased with this product.  From the moment you open the box you can smell them and they are still sealed in their bag.  They are very pliable unlike most of the big store ones and the seeds are very moist and easy to remove.  I needed to make a new batch of vanilla sugar and this was the first time I had to put some crackers in with it as the sugar was clumping within a week.  Should make an interesting cracker too.<br />John
750,"This product had pretty good reviews so I thought it would be safe to buy 4 packages, so I did. Boy am I full of regret now. I'm stuck with 4 packs of these beans and I can't return any them. The moment I opened the bag, I should've known. It had a stale sour smell to them. But the optimistic side of me said, these beans look fresh and plump, maybe it won't smell like that once I scrape the seeds out. I was wrong. I made two test batches to see if it was the salt I was using to make my vanilla salt but they both have that weird sour, rancid smell. I've made vanilla salt before so I know what it's supposed to smell and taste like. Unfortunately, even after a few days, this smell isn't going away. I was really looking forward to making jars of vanilla salt to give out as cheap gifts. But now I need to go buy more vanilla beans to replace these which is going to end up costing me. I'm so disappointed. I haven't cooked with these seeds so I don't know if the taste and smell transforms with heat or with any other mixed in ingredient. I know for sure though that if you're looking to make vanilla extract, vanilla sugar or vanilla salt, I HIGHLY discourage you from buying this product."
751,Got 58 beans in the 1/2 lbs package which is a great value. They are moist so they are super fresh. Great Find.
752,I received my beans quickly and they smelled great!  I used all of them pretty quickly.  I purchased three 1.75 l bottles of vodka and split the beans evenly among them. They were plump and looked great.  I'm excited to give my homemade vanilla as Christmas gifts.
753,I received these wonderful beans today through Amazon.  I have not opened the vacuum sealed bag yet but the fragrance is divine.  They are about 6-3/4 inches long and plump and soft. It looks like there are maybe 60-70 beans.
754,"Arrived very quickly and packaged safely.  They are vacuumed sealed and then put within a thick plastic ziplock bag.  Even with the packaging I could smell the vanilla when I opened my UPS box.  There are so many beans in here, a very great buy for my homemade vanilla extract!!"
755,"I could smell the vanilla from the box it was packaged in. It was sealed shut, air extracted from the packaging, so plump & moist.  I specifically got this product based on the comments left from a Pastry Chef.  I am extremely happy with my purchase.  I will definitely be back for these again.  I use them in frosting and cake batters - it's soooooo good, words cannot describe the freshness you get with a real vanilla bean vs. an extract.  They were very easy to extract the beans from."
756,"I highly recommend this seller. It is an incredible value for both quantity and quality of beans. There are probably around 50-60 beans, although I'm not positive because I have not taken them out of the packaging to count. I have probably used about 8-10 beans and I can barely tell any are gone from the bag. They come double-sealed, and as another reviewer mentioned, you can smell the vanilla even through the original shipping package. I have purchased grocery store vanilla beans, and I have never seen or tasted anything remotely close to the quality of these beans. I will definitely purchase beans from this seller again."
757,"I got these 2 weeks ago, for the price i wasnt expecting much, but they are really fresh and fragrant<br />i've used them to make bavarian cream and creme brulee and they taste great."
758,"I got the beans in the prescribed amount of time, and even before I opened the package I knew they were going to be great.  The amazing aroma of the beans was evident and only intensified after I actually opened the packaging.  I bought them explicitly to make my own vanilla extract, and I have to say they are some juicy beans.  I highly recommend them."
759,"The beans smell great and you get a lot of them. If you get a 12 pack of jars and you put 2 beans in each jar, you will still have more than half of them left over. Im trying to figure out what else I can do with them before they go bad."
760,Great price.  Wonderful product.  Everything was as described.  Shipped quickly and was priced great as far as I can tell.  I use these to infuse vodka. (slice the beans down their length first).  Wonderful!
761,I was amazed with how fresh these are and there are so many in 1/2 a pound.  My only suggested would be if you have another person that loves them as much as you do you could split the cost and the beans.  I have so many left over beans I've been giving them away to grateful coworkers but what goes around comes around so here's to awesome ingredients!
762,Great vanilla beans at a great price.  I recieved about 60 beans in my pack.  They are plump and perfect.  When I've used them all up I will definitely be buying them again!  I almost didn't order them because of the reviews talking about the bad smell to them. I'm glad I didn't listen to them.  They smell like all of the other vanilla beans that I've bought.
763,This is the buy of a lifetime.  $25 for about 50 beans instead of $10 for 2!  And the flavor was great.  Made ice cream that everyone raved about.  I vacuum sealed portions for future use to keep them as fresh as possible.
764,I bought these vanilla beans about a month ago to make homemade vanilla extract and also to have on hand since I always seem to have some culinary use for vanilla beans. I was very impressed with the quality. The dried up store bought vanilla beans cannot compare to these. Will be ordering more soon!
765,Recieved Vanilla beans in a nice bundle in a ziploc bag.  The smell was wonderful even through the bag.  My husband and I used the Vanilla beans to make our own Vanilla extract.  The beans were moist and easy to work with.  We were very impressed and would definitely buy the vanilla beans again. Can't wait to see how the homemade vanilla extract turns out.
766,"I got the wonderful vanilla beans about a month ago. The first thing I did was to make vanilla sugar. Then I put 10 split beans in 3/4 cup mix of rum and brandy. I shake it every other day. Smells wonderful so far.  I'm going to split a few beans to put on my stevia  which I use every day.  I also sent a pack of Madascar Bourbon vanilla beans to my 78 year old big sister but she ""freaked "" out.  ""What will I do with these?"".<br />So far I find these vanilla beans luxuriously wonderful. Smelly, soft and tasty if you just take a tiny bite in your morning coffee."
767,"These are unbelievably fantastic!  I had to share them, I had so many!  simply the BEST! I put the leftover pods in my sugar, smells amazing!"
768,"These have good flavor. Plenty of other reviews address that. I also like the thick zipper bag they came in. My only real issue with these is that mine grew mold. I've never had vanilla beans do that before. These seemed unusually moist, so maybe that contributed to the issue. It started as a small spot, but grew so that it was on the ends of most of the beans. I finally got them all out, trimmed off the moldy bits, and froze what was left.<br /><br />It took 2-3 months for the mold to start, so if you use them quickly maybe that won't be a problem. But, I don't go through them that fast. I've had beans dry out in the past, but this is the first I've seen of mold. If you don't plan to use them within 2 months or so, I recommend keeping them in a fridge, freezer or coming up with some other way to stop the mold before it starts."
769,"These beans are trully wonderful and wonderfully priced. Split a few down the length toss in a bottle of Vodka or Rum or some Bourbon for a few days and you have a wonderfull drink. Great for baking , make truly amazing vanilia bean cookies."
770,These will last a long time the way we use them but could not pass up the deal..came sealed and you could still smell the vanilla...stick one or 2 in your favorite vodka and wait a few weeks...we also make our own extract from them.
771,"The first thing you notice when you open up your package is the intensely delicious smell of vanilla.  The package is vacuum sealed, but the smell still leaks out.  These beans are a great deal!  I think I got about 28-32 pods in my bag and was able to make good use of them.  They (as previously mentioned) have a wonderful smell and great flavor.  It is really hard to find a better deal out there."
772,"These beans are magic. Plump, moist, potent. The aroma was so rich that I could smell the deliciousness even before I opened the double-wrapped, vacuum-packed plastic bag. The best thing, though, is the price for this outstanding quality. Two weeks ago, out of dire necessity, I paid over $8 for a single vanilla bean in my grocery store spice aisle. The bean was fine, but $8? Really? When I saw these I rejoiced. Less than 50 cents a bean! Now that I have them and have had some home-made vanilla ice cream made with them, I can safely say this is the single best value I've ever found on Amazon in all the years I've shopped here. I'm sorry the one buyer received a bad batch of these. Mine are perfect. I will definitely be buying again."
773,"I was very pleased with my recent Vanilla Bean purchase from Spice world. When I opened the box, and not even unsealed the beans themselves, I could smell the fragrance of the bean, and see that they were in very good condition. The have been very moist,easy to work with, and taste wonderful. I can't recommend these people too much, and to say I was completely satisfied wouldn't do them justice. I like finding a place I can shop from that will meet my demands for taste and quality... I have a new home!"
774,"well packaged, and alot of beans for the price(50+).  using them to make home made vanilla extract.  wounderfull flavor. will buy again."
775,"The beans arrived in good time, moist and supple, no mold, very good flavor.  What else is there to want in regular bourbon vanilla beans?  I was very pleased with this purchase."
776,I couldn't be more pleased with my purchase. Vanilla beans are $5 - $9 a piece if you can find them in the store. These work out to about 51 cents a piece and they are fresher and better quality than the $5 ones. They also come vacuum sealed and a zip lock bag is included for storage after opening. Good job!
777,"I bought the vanilla beans to make DIY vanilla extract. I do alot of baking and I like to use good vanilla. The recipe requires moist, full vanilla beans and these were wonderful.The vanilla beans came in a vacuum pack that kept them in very good condition, much better than buying them from the spice section of the grocery store where the jar contains 2 to 3 dehydrated beans. And they made great vanilla extract for much less money than buying the 'real' vanilla at the store."
778,Can't be the price!  The beans have a strong aroma and tasted GREAT in creme brulee!  Just be sure to have an air-tight jar and a vacuum sealer isn't a bad idea either to keep them as long as possible.
779,"I got these beans based on the good reviews and wasn't disappointed. I also got 70 beans in my pouch, nice moist and supple pods that will make a gallon of vanilla extract. Great beans for a great price!!!"
780,I could smell the vanilla even through the packaging!<br />There were lots of vanilla beans and they were all in great shape.  I'm excited to see how my homemade vanilla extract turns out!
781,"I've ordered these before and I am still thrilled with the product.  They are fresh, soft and very fragrant.  I use a lot of vanilla bean because my family loves vanilla sauce and baked goods made with the fresh bean.  You must seal these very tightly to keep them soft (I use the seal-a-meal), but with care, they will stay nice for months and you can't beat the price!  McCormick sells vanilla beans in a jar and you get two or three beans for anywhere up to $6! And the quality isn't anywhere near what these are.  I will continue to buy this product."
782,"Cooking with fresh ingredients always makes your dishes taste, and smell, more delicious!  Highly recommend purchasing these vanilla beans, they arrived vacuum packed and ready to use."
783,"These beans were amazing for the price.  Plump, moist and delightful smelling. Made 1.5L of extract with them using silver rum for the alcohol."
784,I was very pleased when I got these vanilla beans. They were shipped in a timely manner and arrived vacuumed sealed. There was a mix of some very plump beans and a few that were thin. I was very happy with my purchase!
